{
  "case_id": "IN-004",
  "expected_overall": "FAIL",
  "expected_findings": [
    {
      "rule_id": "RULE-IN-FOOD-001",
      "expected_status": "PASS"
    },
    {
      "rule_id": "RULE-IN-FOOD-002",
      "expected_status": "PASS"
    },
    {
      "rule_id": "RULE-IN-FOOD-003",
      "expected_status": "PASS"
    },
    {
      "rule_id": "RULE-IN-FOOD-004",
      "expected_status": "PASS"
    },
    {
      "rule_id": "RULE-IN-FOOD-005",
      "expected_status": "PASS"
    },
    {
      "rule_id": "RULE-IN-FOOD-006",
      "expected_status": "FAIL",
      "rationale": "No FSSAI logo or licence number appears anywhere on the pack."
    },
    {
      "rule_id": "RULE-IN-FOOD-007",
      "expected_status": "PASS"
    },
    {
      "rule_id": "RULE-IN-FOOD-008",
      "expected_status": "FAIL",
      "rationale": "No batch, lot or code number is printed."
    },
    {
      "rule_id": "RULE-IN-FOOD-009",
      "expected_status": "FAIL",
      "rationale": "No date of manufacture, packaging, expiry or use by date is printed."
    },
    {
      "rule_id": "RULE-IN-FOOD-010",
      "expected_status": "NOT_APPLICABLE"
    },
    {
      "rule_id": "RULE-IN-FOOD-014",
      "expected_status": "NOT_APPLICABLE"
    },
    {
      "rule_id": "RULE-IN-FOOD-011",
      "expected_status": "PASS"
    },
    {
      "rule_id": "RULE-IN-FOOD-012",
      "expected_status": "NEEDS_REVIEW",
      "accept_also": [
        "PASS"
      ]
    },
    {
      "rule_id": "RULE-IN-FOOD-013",
      "expected_status": "NOT_APPLICABLE"
    }
  ],
  "trap": "Systems that stop analysis after finding the first missing requirement, or that only reliably catch one violation type, will under-report the true count of three failures here.",
  "notes": "Tests recall on multiple simultaneous distinct violations in one label."
}
