{
  "case_id": "UK-004",
  "expected_overall": "FAIL",
  "expected_findings": [
    {"rule_id": "RULE-UK-FOOD-001", "expected_status": "PASS"},
    {"rule_id": "RULE-UK-FOOD-002", "expected_status": "PASS"},
    {"rule_id": "RULE-UK-FOOD-003", "expected_status": "NOT_APPLICABLE", "rationale": "Aspartame is not one of the 14 regulated allergens; no allergen from the list is present in this product."},
    {"rule_id": "RULE-UK-FOOD-004", "expected_status": "PASS"},
    {"rule_id": "RULE-UK-FOOD-005", "expected_status": "PASS"},
    {"rule_id": "RULE-UK-FOOD-006", "expected_status": "PASS"},
    {"rule_id": "RULE-UK-FOOD-007", "expected_status": "PASS"},
    {"rule_id": "RULE-UK-FOOD-008", "expected_status": "PASS"},
    {"rule_id": "RULE-UK-FOOD-009", "expected_status": "NOT_APPLICABLE", "accept_also": ["PASS"]},
    {"rule_id": "RULE-UK-FOOD-010", "expected_status": "PASS"},
    {"rule_id": "RULE-UK-FOOD-011", "expected_status": "NEEDS_REVIEW", "accept_also": ["PASS"]},
    {"rule_id": "RULE-UK-FOOD-012", "expected_status": "FAIL", "rationale": "Aspartame is present but no phenylalanine warning statement appears anywhere on the label."}
  ],
  "trap": "The capitalised, E-number-annotated aspartame entry looks similar in style to a properly emphasised allergen, which can lead a system to either misclassify it as an allergen matter (and check the wrong rule) or to assume its prominent styling itself satisfies some kind of warning requirement, when the actual required warning text is entirely separate and absent.",
  "notes": "UK counterpart to IN-006, testing the sweetener/warning trigger path specifically, distinct from the allergen path."
}
